<?xml version="1.0" encoding="UTF-8"?>
<!--
To change this license header, choose License Headers in Project Properties.
To change this template file, choose Tools | Templates
and open the template in the editor.
-->


<BOOKS
    xmlns:xsi='http://www.w3.org/2001/XMLSchema-instance'
    xsi:noNamespaceSchemaLocation='ass1.xsd'>
    <BOOK book="">
        <title></title>
        <edition></edition>
        <author>
            <firstName></firstName>
            <middleName></middleName>
            <lastName></lastName>
        </author>
        <author>
            <firstName></firstName>
            <middleName></middleName>
            <lastName></lastName>
        </author>
        <publishedDate></publishedDate>
        <type></type>
        <price></price>
    </BOOK>

</BOOKS>
